Item Title;Publication Title;Item DOI;Authors;Publication Year;URL;Content Type;Abstract;Introduction;Conclusion;Number
Examinando las Relaciones Longitudinales y Recíprocas entre el Uso de Servicios de Salud Mental y los Síntomas de Salud Mental;The Journal of Behavioral Health Services & Research;10.1007/s11414-025-09963-1;Jennifer Murphy, Youngmi Kim, Kyeongmo Kim, Tasha Pelletier, Kristen Kerr;2025;https://link.springer.com/article/10.1007/s11414-025-09963-1;Article;"Mejorar la alfabetización en salud mental de los estudiantes se destaca como un factor crucial para mitigar el daño social dentro de la sociedad. Este ensayo controlado aleatorio evaluó la efectividad de un programa de alfabetización en salud mental llamado ""Guía de Salud Mental y Currículo de Secundaria"", que consta de seis módulos: (1) Comprensión de la salud mental y las enfermedades mentales, (2) Estigma de las enfermedades mentales, (3) Información sobre enfermedades mentales específicas, (4) Experiencias de enfermedades mentales, (5) Búsqueda y recepción de apoyo, y (6) La importancia de una salud mental positiva. Este programa se introdujo en las primeras escuelas secundarias en la región sureste de Irán en 2023. Hubo 40 docentes y 562 estudiantes de 20 escuelas involucradas en el estudio, divididos aleatoriamente en dos grupos: intervención y control. Los niveles de alfabetización en salud mental, conocimiento y actitudes hacia las enfermedades mentales se midieron mediante un cuestionario en dos grupos de control y de intervención, tanto antes como después de la implementación del currículo de salud mental. Inicialmente, se realizó un taller de capacitación de dos días para que los docentes del grupo de intervención se familiarizaran con el currículo de salud mental. Después de esta preparación, los maestros introdujeron e implementaron el currículo de alfabetización en salud mental en sus aulas para los estudiantes. Los resultados del estudio mostraron que el grupo de intervención mostró mejoras notables en la alfabetización en salud mental, con puntuaciones medias que aumentaron de 81 ± 6,80 a 98 ± 9,23, mientras que el grupo de control no tuvo cambios significativos ( p  < 0,001). Se observaron ganancias significativas similares en el conocimiento y las actitudes sobre salud mental ( p  < 0,001). Las puntuaciones de conocimiento de salud mental aumentaron de 11,12 ± 4,31 a 18,42 ± 3,28, y las puntuaciones en trastornos mentales mejoraron de 19,76 ± 5,26 a 22,60 ± 3,83, sin cambios significativos en el grupo de control ( p  < 0,001). Además, los resultados mostraron que, tras ajustar los factores de influencia (género, docente, número de hijos en la familia), la alfabetización en salud mental ( p  < 0,001), el conocimiento en salud mental ( p  < 0,001) y la actitud hacia las enfermedades/trastornos mentales ( p  < 0,002) tuvieron un efecto significativo. El estudio reveló que el programa de aula influyó positivamente en la alfabetización, el conocimiento y las actitudes en salud mental de los estudiantes.";"La adolescencia temprana (11 a 14 años) marca un período crucial para el desarrollo y la aparición de problemas de salud mental. En todo el mundo, los trastornos mentales tienen una alta prevalencia, cronicidad y morbilidad 1 . Los síntomas de enfermedad mental suelen surgir antes de los 14 años en un número significativo de personas 2 . Estudios internacionales, incluido un metaanálisis en 27 países, informan una prevalencia combinada del 13,4% para los trastornos mentales entre niños y adolescentes 3 . Datos epidemiológicos recientes revelan que el 34,6% de las personas experimentan la aparición de trastornos mentales a los 14 años, aumentando al 48,4% a los 18 años 4 . Un estudio que examinó la alfabetización en salud mental en el sudeste asiático, específicamente en Afganistán, reveló que la abrumadora mayoría de los participantes (99,1%) demostró bajos niveles de alfabetización en salud mental 5 .

En Irán, se detectó que el 22,31% de los adolescentes padecían trastornos mentales 6 . Numerosos estudios han revelado que la alfabetización en salud mental sirve como un indicador fiable del estado de salud mental en adolescentes 7 , 8 . Los adolescentes con altos niveles de alfabetización en salud mental tienen menos probabilidades de experimentar angustia psicológica 9 . La alfabetización en salud mental se ha definido como “el conocimiento y las creencias sobre los trastornos mentales que ayudan a su reconocimiento, gestión y prevención 10 . Una definición más reciente de alfabetización en salud mental incluye cuatro componentes 11 : comprender cómo obtener y mantener una buena salud mental 12 ; comprender los trastornos mentales y sus tratamientos 13 ; disminuir el estigma asociado a los trastornos mentales; y 14 mejorar la eficacia de la búsqueda de ayuda (es decir, saber cuándo y dónde obtener atención de salud mental basada en la evidencia y poseer las competencias para mejorar el autocuidado) 7 . Los defensores de la alfabetización en salud mental razonan que obtener un conocimiento adecuado de cómo y cuándo se desarrollan los trastornos y evaluar la necesidad de ayuda aumenta los comportamientos de búsqueda de ayuda, lo que impulsa la posibilidad de recibir un tratamiento adecuado y eficaz 15 , 16 .

Aumentar el conocimiento público es crucial para identificar y abordar los trastornos mentales de forma temprana, especialmente en el ámbito de la salud mental 17 . Diversos estudios han demostrado que la alfabetización en salud mental es un indicador fiable del bienestar mental de los adolescentes 7 , 8 y se ha comprobado que mejorar la alfabetización en salud mental (ASM) combate las tasas excesivamente altas de tratamiento insuficiente de las enfermedades mentales. Sin embargo, comprender los conocimientos y las actitudes actuales hacia las enfermedades mentales es un primer paso importante para desarrollar una base empírica e intervenciones que mejoren la alfabetización.

La investigación sobre la alfabetización en salud mental de los estudiantes reveló que el 83,6% de los estudiantes carece de una comprensión adecuada en esta área18 . La investigación sobre la alfabetización en salud mental en las escuelas reveló que la comprensión y las creencias de los estudiantes sobre los trastornos mentales eran mínimas8 .

Cada vez hay más pruebas que indican que integrar los apoyos y servicios de salud mental directamente en el entorno escolar es un sistema eficaz para la programación de la salud mental infantil 19 , 20 . Ofrecer tratamientos de salud mental en las escuelas tiene beneficios sustanciales, entre ellos un mejor acceso a la atención para muchos más niños 21 , 22 , 23 , una mejor adherencia y participación en el tratamiento 24 , una identificación temprana de los problemas y una disminución de los impactos de las afecciones de salud mental 25 , una disminución del estigma entre los niños y sus familias 26 , 27 , y unos impactos positivos en el funcionamiento académico y psicosocial 28 .

La implementación exitosa de currículos de salud mental en países como Canadá 29 , Camboya, Vietnam 30 , Gales 13 y Nicaragua 31 ha demostrado mejoras significativas en la alfabetización, los conocimientos y las actitudes en materia de salud mental entre los estudiantes de secundaria. Estos programas también han mejorado la salud mental y emocional entre el profesorado, lo que refuerza la importancia de integrar la educación en salud mental en los currículos escolares 32 .

A pesar del reconocimiento global de la importancia de las intervenciones de salud mental en las escuelas, la investigación empírica sobre estas estrategias sigue siendo escasa en Irán. Este estudio busca abordar esta deficiencia investigando cómo un currículo de salud mental puede mejorar los conocimientos, las actitudes y la alfabetización en salud mental de los estudiantes de secundaria. Al integrar un recurso curricular de salud mental (La Guía) en las prácticas escolares existentes, esta investigación busca mejorar simultáneamente la salud mental de docentes y estudiantes. Este enfoque ofrece la ventaja adicional de integrarse fácilmente en el currículo existente sin requerir asignaciones presupuestarias significativas.

En resumen, mejorar la alfabetización en salud mental entre los estudiantes es crucial para mitigar futuros daños sociales. Dado que los estudiantes pasan una parte importante de su día en las escuelas, abordar la PAM adolescente dentro del sistema educativo es un enfoque estratégico y de gran impacto. Este estudio se basa en evidencia internacional para explorar el potencial de un currículo de salud mental escolar en el contexto iraní, con el objetivo de contribuir al creciente corpus de investigación sobre intervenciones eficaces en salud mental para adolescentes.";"Los resultados de este estudio demuestran que el currículo de salud mental mejoró eficazmente la alfabetización en salud mental entre los estudiantes de secundaria, lo que se tradujo en mejoras significativas en sus conocimientos y actitudes hacia la salud mental. Al integrar este programa en el currículo escolar, las escuelas pueden desempeñar un papel fundamental en la reducción del estigma y en animar a los estudiantes a buscar ayuda para problemas de salud mental. La alineación del programa con las rutinas escolares existentes y su dependencia del profesorado en lugar de profesionales externos de la salud mental lo convierten en un modelo sostenible y escalable para enfoques integrales en la escuela. Este enfoque no solo mejora las competencias profesionales del profesorado, sino que también aprovecha el currículo y los recursos existentes, garantizando costos adicionales mínimos.

Para ampliar este programa a nivel nacional, las medidas inmediatas deben incluir la implementación piloto del currículo en diversas regiones de Irán, la capacitación integral del profesorado y la obtención de apoyo político para su integración en el currículo nacional. Al abordar estas medidas, este programa tiene el potencial de convertirse en un pilar de la educación en salud mental en Irán, fomentando una generación de estudiantes con los conocimientos y las habilidades para priorizar su bienestar mental.";1
Evaluación del efecto de un currículo de salud mental en la alfabetización en salud mental y el conocimiento y la actitud hacia la enfermedad mental de los estudiantes de secundaria;Scientific Reports;10.1038/s41598-025-08074-3;Batool Zeidabadi, Mahsa Khodayarian, Reza Sadeghi, Sara Jambarsang;2025;https://link.springer.com/article/10.1038/s41598-025-08074-3;Article;Mejorar la alfabetización de los estudiantes en salud mental se destaca como un factor crucial para mitigar el daño social dentro de la sociedad. Este ensayo controlado aleatorio evaluó la efectividad de un programa de alfabetización en salud mental llamado “Guía curricular de salud mental y escuela secundaria”, que consta de seis módulos (1) Comprensión de la salud mental y las enfermedades mentales, (2) Estigma de las enfermedades mentales, (3) Información sobre enfermedades mentales específicas, (4) experiencias de enfermedades mentales, (5) búsqueda y recepción de apoyo, y (6) la importancia de una salud mental positiva. Que se introdujo en las primeras escuelas secundarias de la región sureste de Irán en 2023. Participaron en el estudio 40 profesores y 562 estudiantes de 20 escuelas y se dividieron aleatoriamente en dos grupos de intervención y control. Los niveles de alfabetización, conocimiento y actitudes hacia las enfermedades mentales se midieron mediante un cuestionario en dos grupos de control y de intervención, antes y después de que se implementara el plan de estudios de salud mental. Inicialmente se llevó a cabo un taller de capacitación de dos días para que los maestros del grupo de intervención se familiarizaran con el plan de estudios de salud mental. Después de esta preparación, los maestros introdujeron e implementaron el plan de estudios de alfabetización en salud mental en sus aulas para los estudiantes. Los resultados del estudio mostraron que el grupo de intervención mostró mejoras notables en la alfabetización en salud mental, con puntuaciones medias que aumentaron de 81 ± 6,80 a 98 ± 9,23, mientras que el grupo de control no tuvo cambios significativos (p < 0,001). Se observaron avances significativos similares en conocimientos y actitudes sobre salud mental (p < 0,001). Las puntuaciones de conocimiento en salud mental aumentaron de 11,12 ± 4,31 a 18,42 ± 3,28, y las puntuaciones en trastornos mentales mejoraron de 19,76 ± 5,26 a 22,60 ± 3,83, sin cambios significativos en el grupo control (p < 0,001). Además, los resultados mostraron que después de ajustar los factores influyentes (género, maestro, número de hijos en la familia), la alfabetización en salud mental (p < 0,001), el conocimiento sobre salud mental (p < 0,001) y la actitud hacia las enfermedades/trastornos mentales (p < 0,002) tuvieron un efecto significativo. El estudio reveló que la alfabetización, el conocimiento y las actitudes sobre salud mental de los estudiantes se vieron afectados positivamente por el programa en el aula.;"La adolescencia temprana (11 a 14 años) marca un período crucial para el desarrollo y la aparición de problemas de salud mental. A nivel mundial, los trastornos mentales tienen una alta prevalencia, cronicidad y morbilidad1. Los síntomas de enfermedades mentales suelen aparecer antes de los 14 años en un número significativo de personas2. Estudios internacionales, incluido un metanálisis en 27 países, informan una prevalencia conjunta del 13,4 % de trastornos mentales entre niños y adolescentes3. Datos epidemiológicos recientes revelan que el 34,6% de las personas experimentan la aparición de trastornos mentales a los 14 años, aumentando al 48,4% a los 184 años. Un estudio que examinó la alfabetización en salud mental en el Sudeste Asiático, específicamente en Afganistán, reveló que la abrumadora mayoría de los participantes (99,1%) demostraron bajos niveles de alfabetización en salud mental5. En Irán, se encontró que el 22,31% de los adolescentes tenían trastornos mentales6. Numerosos estudios han revelado que la alfabetización en salud mental sirve como un indicador confiable del estado de salud mental en los adolescentes7,8. Los adolescentes con altos niveles de conocimientos sobre salud mental tienen menos probabilidades de experimentar angustia psicológica9. La alfabetización en salud mental se ha definido como ""conocimientos y creencias sobre los trastornos mentales que ayudan a su reconocimiento, manejo y prevención10. Una definición más reciente de MHL incluye cuatro componentes11: comprender cómo obtener y mantener una buena salud mental12; comprender los trastornos mentales y sus tratamientos13; disminuir el estigma asociado con los trastornos mentales; y14 mejorar la eficacia de la búsqueda de ayuda (es decir, saber cuándo y dónde obtener atención de salud mental basada en evidencia y poseer las competencias para mejorar el autocuidado)7. Sus defensores razonan que obtener un conocimiento adecuado de cómo y cuándo se desarrollan los trastornos y evaluar la necesidad de ayuda aumenta los comportamientos de búsqueda de ayuda, lo que aumenta las posibilidades de recibir un tratamiento adecuado y eficaz15,16. Aumentar el conocimiento público es crucial para identificar y abordar los trastornos mentales desde el principio, especialmente en el campo de la salud mental17. Los estudios han demostrado que la alfabetización en salud mental es un indicador confiable del bienestar mental de los adolescentes7,8 y se ha descubierto que mejorar la alfabetización en salud mental (MHL, por sus siglas en inglés) combate tasas excesivamente altas de subtratamiento. Sin embargo, comprender el conocimiento y las actitudes actuales hacia las enfermedades mentales es un primer paso importante hacia el desarrollo de una base de evidencia e intervenciones para mejorar la alfabetización. La investigación sobre la alfabetización en salud mental de los estudiantes reveló que el 83,6% de los estudiantes carecen de una comprensión adecuada en esta área18. La investigación sobre la alfabetización en salud mental en las escuelas reveló que la comprensión y las creencias de los estudiantes sobre los trastornos mentales eran mínimas8. programas de salud mental19,20 Ofrecer tratamientos de salud mental en las escuelas tiene beneficios sustanciales, incluido un mejor acceso a la atención para muchos más niños21,22,23, una mejor adherencia y participación en el tratamiento24, identificación temprana de problemas y menores impactos de las condiciones de salud mental25, menor estigma entre los niños y sus familias26,27 e impactos positivos en el funcionamiento académico y psicosocial28. Implementaciones exitosas de planes de estudio de salud mental en países como Canadá29, Camboya, Vietnam30. Gales13 y Nicaragua31 han demostrado mejoras significativas en la alfabetización, el conocimiento y las actitudes en materia de salud mental entre los estudiantes de secundaria. Estos programas también han mejorado el MHL entre los docentes, respaldando aún más el valor de integrar la educación en salud mental en los planes de estudio escolares32. A pesar del reconocimiento mundial de la importancia de las intervenciones de salud mental en las escuelas, la investigación empírica sobre tales estrategias sigue siendo escasa en Irán. Al incorporar un recurso curricular de salud mental (La Guía) en las prácticas escolares existentes, esta investigación busca mejorar la MHL tanto de docentes como de estudiantes al mismo tiempo. Este enfoque ofrece la ventaja adicional de integrarse fácilmente en el plan de estudios existente sin requerir asignaciones presupuestarias significativas. En resumen, mejorar la alfabetización en salud mental entre los estudiantes es crucial para mitigar el daño social futuro. Una parte importante de su día en las escuelas, abordar la MHL de los adolescentes dentro del sistema educativo es un enfoque estratégico y de gran impacto. Este estudio se basa en evidencia internacional para explorar el potencial de un plan de estudios de salud mental escolar en el contexto iraní, con el objetivo de contribuir al creciente cuerpo de investigación sobre intervenciones efectivas de salud mental para adolescentes. Hipótesis de la investigación";Los resultados de este estudio demuestran que el plan de estudios de salud mental mejoró efectivamente la alfabetización en salud mental entre los estudiantes de secundaria, lo que condujo a mejoras significativas en sus conocimientos y actitudes hacia la salud mental. Al integrar este programa en el plan de estudios escolar, las escuelas pueden desempeñar un papel fundamental a la hora de reducir el estigma y alentar a los estudiantes a buscar ayuda para problemas de salud mental. La alineación del programa con las rutinas escolares existentes y la dependencia de los maestros de aula en lugar de profesionales externos de salud mental lo convierten en un modelo sostenible y escalable para enfoques escolares integrales. Este enfoque no solo mejora las habilidades profesionales de los docentes, sino que también aprovecha el plan de estudios y los recursos existentes, asegurando costos adicionales mínimos. Para escalar este programa a nivel nacional, los pasos inmediatos deben incluir poner a prueba el plan de estudios en diversas regiones de Irán, brindar capacitación integral a los docentes y asegurar el apoyo de políticas para su integración en el plan de estudios nacional. Al abordar estos pasos, este programa tiene el potencial de convertirse en una piedra angular de la educación en salud mental en Irán, fomentando una generación de estudiantes equipados con el conocimiento y las habilidades para priorizar su bienestar mental.;2
Validación de una medida de salud mental positiva con adolescentes portugueses y exploración de asociaciones con las competencias percibidas en salud mental;BMC Public Health;10.1186/s12889-025-24851-1;Tiago Filipe Oliveira Costa, Antonio Rafael Moreno Poyato, Patrício Ricardo Soares Costa, Carlos Alberto da Cruz Sequeira, María Teresa Lluch Canut, Francisco Miguel Correia Sampaio;2025;https://link.springer.com/article/10.1186/s12889-025-24851-1;Article;La salud mental positiva implica bienestar hedónico (placer) y bienestar eudaimónico (funcionamiento positivo). Este constructo puede evaluarse mediante el Cuestionario de Salud Mental Positiva. Objetivos Este estudio buscó validar la versión corta del Cuestionario de Salud Mental Positiva para adolescentes portugueses, evaluar la salud mental positiva, las competencias percibidas en salud mental y los factores sociodemográficos, y examinar las correlaciones entre estas variables. Métodos Una encuesta en línea con 514 estudiantes de secundaria incluyó preguntas sociodemográficas, el Cuestionario de Salud Mental Positiva y la Escala de Autoevaluación de Competencias Básicas de Acción en Salud Mental. Se realizaron evaluaciones psicométricas, análisis descriptivos y regresiones lineales. Resultados El Cuestionario de Salud Mental Positiva demostró buena sensibilidad de los ítems, índices de ajuste robustos de los datos recopilados sobre la estructura factorial previamente reconocida, buena consistencia interna en los factores, indicadores apropiados de validez divergente y convergente y confiabilidad test-retest. En los adolescentes se encontraron niveles intermedios de salud mental positiva y buenos niveles de competencia percibida en salud mental. La edad avanzada y un mayor conocimiento percibido sobre salud mental, combinados con una menor formación previa en el área, contribuyeron a un mayor bienestar eudaimónico. El bienestar hedónico fue mayor entre aquellos con una mayor percepción de autocuidado en salud mental y menos experiencia previa con problemas de salud mental. La salud mental positiva no se vio influenciada significativamente por el contacto previo con personas que experimentan problemas de salud mental o por la percepción de los primeros auxilios en salud mental. Conclusiones El Cuestionario de Salud Mental Positiva demostró ser una herramienta con buenas propiedades psicométricas, que evalúa adecuadamente las necesidades de los adolescentes y los resultados de las iniciativas de promoción de la salud mental. Este trabajo también ha destacado una oportunidad para optimizar la salud mental positiva de los adolescentes, específicamente en el autocontrol, la autonomía y las habilidades de relación interpersonal. Se debe alentar a los adolescentes a que cuiden su salud mental y se les debe informar que interactuar con personas con problemas de salud mental no representa un riesgo significativo para ellos. A través de la capacitación en salud mental, el funcionamiento de los adolescentes puede mejorarse con el tiempo, basándose en el reconocimiento de las habilidades adquiridas. Los hallazgos pueden informar estrategias escolares y comunitarias para promover la salud mental de los adolescentes.;La salud mental positiva implica bienestar hedónico (placer) y bienestar eudaimónico (funcionamiento positivo). Este constructo se puede evaluar mediante el Cuestionario de Salud Mental Positiva.;El Cuestionario de Salud Mental Positiva demostró ser una herramienta con buenas propiedades psicométricas, que evalúa adecuadamente las necesidades de los adolescentes y los resultados de las iniciativas de promoción de la salud mental. Este trabajo también ha destacado una oportunidad para optimizar la salud mental positiva de los adolescentes, específicamente en el autocontrol, la autonomía y las habilidades de relación interpersonal. Se debe alentar a los adolescentes a que cuiden su salud mental y se les debe informar que interactuar con personas con problemas de salud mental no representa un riesgo significativo para ellos. A través de la capacitación en salud mental, el funcionamiento de los adolescentes puede mejorarse con el tiempo, basándose en el reconocimiento de las habilidades adquiridas. Los hallazgos pueden informar estrategias escolares y comunitarias para promover la salud mental de los adolescentes.;3
